{"schema_version":"serverless-output-receipt/v3","output_receipt_id":"output-a","dispatch_token":"dispatch-token-0123456789abcdef0123456789abcdef","attempt_id":"attempt-a","assignment_id":"assignment-a","tenant":{"account_id":"account-a","workspace_id":"workspace-a"},"lane":"mage_image","acceptance":"ACCEPTED_CANONICAL","durable_truth_source":"SIGNED_PRIVATE_R2_RECEIPT","artifacts":[{"item_id":"scene-1","object_key":"tenant/account-a/workspace/workspace-a/project/project-a/revision/revision-a/lane/mage-image/job/attempt-a/artifact/scene-1","content_length":812345,"checksum_sha256":"sha256:dddddddddddddddddddddddddddddddddddddddddddddddddddddddddddddddd","probe":{"width":1280,"height":720},"artifact_commit_receipt_sha256":"sha256:eeeeeeeeeeeeeeeeeeeeeeeeeeeeeeeeeeeeeeeeeeeeeeeeeeeeeeeeeeeeeeee"}],"provenance_receipt_sha256":"sha256:cccccccccccccccccccccccccccccccccccccccccccccccccccccccccccccccc","artifact_commit_receipt_sha256":"sha256:ffffffffffffffffffffffffffffffffffffffffffffffffffffffffffffffff","artifact_commit_receipt_sha256s":["sha256:eeeeeeeeeeeeeeeeeeeeeeeeeeeeeeeeeeeeeeeeeeeeeeeeeeeeeeeeeeeeeeee"],"accepted_at":"2026-08-16T07:03:00.000Z","version":1}
